File ID,Data Split,Original English,English,Hindi,Korean
arctic_b0262,train,Saxon's onto her job.,saxon's onto her job.,सैक्सन्स आंतु हर जॉब.,섹슨즈 온투 허 잡.
arctic_b0263,train,Only once did I confide the strangeness of it all to another.,only once did i confide the strangeness of it all to another.,ओनली वन्स डिड आई कन्फाइड द स्ट्रेंजनेस अव इट ऑल टू अनदर.,온리 원스 디드 아이 컨파이드 더 스트레인지니스 어브 잇 올 투 어나더.
arctic_b0264,train,But this time it was Saxon who rebelled.,but this time it was saxon who rebelled.,बट दिस टाइम इट वज सैक्सन हू रिबेल्ड.,벗 디스 타임 잇 워즈 섹슨 후 리벨드.
arctic_b0265,train,I was not to cry out in the face of fear.,i was not to cry out in the face of fear.,आई वज नॉट टू क्राई आउट इन द फेस अव फियर.,아이 워즈 낫 투 크라이 아웃 인 더 페이스 어브 피어.
arctic_b0266,train,And now put yourself in my place for a moment.,and now put yourself in my place for a moment.,एंड नाऊ पुट योर्सेल्फ इन माय प्लेस फॉर अ मोमेंट.,앤드 나우 풋 유어셀프 인 마이 플레이스 포어 아 모먼트.
arctic_b0267,train,The boy threw back his head with pride.,the boy threw back his head with pride.,द बॉय थ्रू बैक हिज़ हेड विथ प्राइड.,더 보이 스루 백 히즈 헤드 위드 프라이드.
arctic_b0268,train,"Saxon nodded, and the boy frowned.","saxon nodded, and the boy frowned.","सैक्सन नॉडेड, ऐंड द बॉय फ्राउन्ड.","색슨 나디드, 앤드 더 보이 프라운드."
arctic_b0269,train,Why not like any railroad station or ferry depot.,why not like any railroad station or ferry depot.,वाई नाट लाइक एनी रेलरोड स्टेशन ऑर फेरी डीपो.,와이 낫 라이크 에니 레일로드 스테이션 오어 페리 디포.
arctic_b0270,train,We could throw stones with our feet.,we could throw stones with our feet.,वी कुड थ्रो स्टोन्स विथ आउर फीट.,위 쿨드 스로우 스톤즈 위드 아워 피트.
arctic_b0271,train,"It was put together in a casual, helter-skelter sort of way.","it was put together in a casual, helter-skelter sort of way.","इट वज़ पुट टुगेदर इन अ कैजुअल, हेल्टर-स्केल्टर सॉर्ट अव वे.","잇 워즈 풋 투게더 인 아 캐주얼, 헬터스켈터 솟 업 웨이."
arctic_b0272,dev,These were merely stout sticks an inch or so in diameter.,these were merely stout sticks an inch or so in diameter.,दीज वर मेरली स्टाउट स्टिक्स अन इंच ऑर सो इन डायमीटर.,디즈 워 미얼리 스타우트 스틱스 안 인치 오어 소 인 다이아미터.
arctic_b0273,train,Then it was that a strange thing happened.,then it was that a strange thing happened.,देन इट वज़ धैट अ स्ट्रेंज थिंग हैपनड.,덴 잇 워즈 댓 아 스트레인지 띵 해펜드.
arctic_b0274,train,From the source of light a harsh voice said.,from the source of light a harsh voice said.,फ्रॉम द सोर्स अव लाइट अ हर्ष वॉइस सैड.,프럼 더 소스 어브 라이트 아 하쉬 보이스 세드.
arctic_b0275,train,But I did not enjoy it long.,but i did not enjoy it long.,बट आई डिड नॉट एन्जॉय इट लॉन्ग.,벗 아이 딛 낫 엔조이 잇 롱.
arctic_b0276,test,We were now good friends.,we were now good friends.,वी वर नाऊ गुड फ्रेंड्स.,위 워 나우 굿 프렌즈.
arctic_b0277,train,Two of the Folk were already up.,two of the folk were already up.,टू अव द फोक वर ऑलरेडी अप.,투 어브 더 포크 워 올레디 업.
arctic_b0278,train,Now animals do not like mockery.,now animals do not like mockery.,नाउ ऐनिमल्स डू नाट लाइक मॉकरी.,나우 애니멀즈 두 낫 라이크 모커리.
arctic_b0279,train,He gave one last snarl and slid from view among the trees.,he gave one last snarl and slid from view among the trees.,ही गेव वन लास्ट स्नार्ल एंड स्लिड फ्रम व्यू अमंग द ट्रीज.,히 게이브 원 라스트 스날 앤드 슬리드 프럼 뷰 어몽 더 트리즈.
arctic_b0280,dev,"Again the girls applauded, and Mrs Hall cried.","again the girls applauded, and missus hall cried.","अगैन द गर्ल्स अप्लॉडेड, ऐंड मिसस हॉल क्राइड.","어겐 더 걸즈 어플로디드, 앤드 미써스 홀 크라이드."
arctic_b0281,train,Just the same I'd sooner be myself than have book indigestion.,just the same i would sooner be myself than have book indigestion.,जस्ट द सेम आई वुड सूनर बी मायसेल्फ धन हैव बुक इन्डिजेशन.,저스트 더 세임 아이 우드 수너 비 마이셀프 댄 해브 북 인디제스천.
arctic_b0282,train,Some of the smaller veins had doubtless been ruptured.,some of the smaller veins had doubtless been ruptured.,सम अव द स्मालर वेन्स हैड डाउटलेस बीन रप्चर्ड.,썸 업 더 스몰러 베인즈 해드 다우트레스 빈 럽처드.
arctic_b0283,dev,But we were without this momentum.,but we were without this momentum.,बट वी वर विदाउट दिस मोमेंटम.,벗 위 워 위다웃 디스 모멘텀.
arctic_b0284,train,"There was one difficulty, however.","there was one difficulty, however.","देर वज़ वन डिफिकल्टी, हावेवर.","데어 워즈 원 디피컬티, 하우에버."
arctic_b0285,train,The hyena proceeded to dine.,the hyena proceeded to dine.,द हैना प्रोसीडेड टू डाइन.,더 하이에나 프로시디드 투 다인.
arctic_b0286,train,The time was considered auspicious.,the time was considered auspicious.,द टाइम वज़ कंसिडर्ड ऑस्पिशस.,더 타임 워즈 컨시더드 오스피셔스.
arctic_b0287,train,Or have they already devised one.,or have they already devised one.,ऑर हैव दे ऑलरेडी डिवाइज़्ड वन.,오어 헤브 데이 올레디 디바이즈드 원.
arctic_b0288,dev,We would not spend another such night.,we would not spend another such night.,वी वुड नॉट स्पेंड अनदर सच नाइट.,위 우드 낫 스펜드 어나더 서치 나잇.
arctic_b0289,train,At first his progress was slow and erratic.,at first his progress was slow and erratic.,ऐट फर्स्ट हिज़ प्रोग्रेस वज़ स्लो ऐंड एरेटिक.,앳 퍼스트 히즈 프로그레스 워즈 슬로우 앤드 에라틱.
arctic_b0290,test,"He placed his paw on one, and its movements were accelerated.","he placed his paw on one, and its movements were accelerated.","ही प्लेस्ट हिज़ पॉ ऑन वन, ऐंड इट्स मूवमेंट्स वर एक्सेलरेटेड.","히 플레이스트 히즈 포 안 원, 앤드 잇츠 무브먼츠 워 액셀러레이티드."
arctic_b0291,train,The awe of man rushed over him again.,the awe of man rushed over him again.,दि ऑ अव मैन रश्ट ओवर हिम अगेन.,디 오 어브 맨 러쉬트 오버 힘 어겐.
arctic_b0292,train,The Fire-Men wore animal skins around their waists and across their shoulders.,the fire-men wore animal skins around their waists and across their shoulders.,द फायरमेन वोर ऐनिमल स्किन्स अराउंड देर वेस्ट्स एंड अक्रॉस देर शोल्डर्स.,더 파이어맨 워 애니멀 스킨즈 어라운드 데어 웨이스트 앤드 어크로스 데어 숄더즈.
arctic_b0293,train,Between him and all domestic animals there must be no hostilities.,between him and all domestic animals there must be no hostilities.,बिटवीन हिम एंड ऑल डोमेस्टिक ऐनिमल्स देर मस्ट बी नो होस्टिलिटीज़.,비트윈 힘 앤드 올 도메스틱 애니멀스 데어 머스트 비 노 호스틸리티즈.
arctic_b0294,dev,For a much longer time Lop-Ear and I remained and watched.,for a much longer time lop-ear and i remained and watched.,फॉर अ मच लॉन्गर टाइम लॉप-ईर ऐंड आई रिमेन्ड ऐंड वॉच्ड.,포어 아 머치 롱거 타임 랍이얼 앤드 아이 리메인드 앤드 와치드.
arctic_b0295,train,"All right, Sir, replied Jock with great regret.","all right, sir, replied jock with great regret.","ऑल राइट, सर, रिप्लाइड जॉक विद ग्रेट रेग्रेट.","올 라잇, 서, 리플라이드 조크 위드 그레이트 리그렛."
arctic_b0296,test,At times I wondered where Sir Archibald got his style.,at times i wondered where sir archibald got his style.,ऐट टाइम्स आई वंडर्ड वेयर सर आर्चिबॉल्ड गॉट हिज़ स्टाइल.,앳 타임즈 아이 원더드 웨어 서 아치볼드 갓 히즈 스타일.
arctic_b0297,dev,Why should a fellow throw up the sponge after the first round.,why should a fellow throw up the sponge after the first round.,वाय शुड अ फेलो थ्रो अप द स्पंज आफ्टर द फर्स्ट राउंड.,와이 슛 아 펠로우 스로우 업 더 스펀지 애프터 더 퍼스트 라운드.
arctic_b0298,train,His hand shot out and clutched Crooked-Leg by the neck.,his hand shot out and clutched crooked-leg by the neck.,हिस हैंड शॉट आउट ऐंड क्लच्ड क्रुकिड-लेग बाई द नेक.,히즈 핸드 샷 아웃 앤드 클러치드 크룩킷레그 바이 더 넥.
arctic_b0299,train,Miss Brodie's smile was slightly sarcastic.,miss brodie's smile was slightly sarcastic.,मिस ब्रोडीज़ स्माइल वज़ स्लाइटली सार्कैस्टिक.,미스 브로디스 스마일 워즈 슬라잇리 사카스틱.
arctic_b0300,train,Does the old boy often go off at half-cock that way.,does the old boy often go off at half-cock that way.,डज दि ओल्ड बॉय ऑफन गो ऑफ ऐट हैफ्कॉक दैट वे.,더즈 디 올드 보이 오픈 고 오프 앳 헤프콕 댓 웨이.
arctic_b0301,train,A flying arrow passed between us.,a flying arrow passed between us.,अ फ्लाइंग ऐरो पैस्ट बिटवीन अस.,아 플라잉 애로우 패스트 비트윈 어스.
arctic_b0302,train,"I pulled, suddenly, with all my might.","i pulled, suddenly, with all my might.","आई पुल्ड, सडनली, विथ ऑल माई माइट.","아이 풀드, 서든리, 위드 올 마이 마이트."
arctic_b0303,train,Here we allow our solicitors to look after our legal work.,here we allow our solicitors to look after our legal work.,हीर वी अलाउ आऊर सॉलिसिटर्स टू लुक आफ्टर आऊर लीगल वर्क.,히어 위 얼라우 아우어 솔리시터즈 투 룩 애프터 아우어 리걸 워크.
arctic_b0304,train,His previous wives had never lived long enough to bear him children.,his previous wives had never lived long enough to bear him children.,हिस प्रीवियस वाइव्ज़ हैड नेवर लिव्ड लॉंग इनफ टू बेअर हिम चिल्ड्रन.,히즈 프리비어스 와이브스 해드 네버 리브드 롱 이너프 투 베어 힘 칠드런.
arctic_b0305,train,It was our river emerging like ourselves from the great swamp.,it was our river emerging like ourselves from the great swamp.,इट वस आउर रिवर इमर्जिंग लाइक आउर्सेल्व्स फ्रम द ग्रेट स्वाम्प.,잇 워즈 아우어 리버 이머징 라이크 아우셀브즈 프럼 더 그레이트 스왐프.
arctic_b0306,train,"Cameron looked at his hands with their long, sinewy fingers.","cameron looked at his hands with their long, sinewy fingers.","कैमरन लुक्ट ऐट हिस हैंड्स विथ देर लॉन्ग, सिन्यूई फिंगर्स.","카메런 룩트 앳 히즈 핸즈 위드 데어 롱, 시뉴이 핑거즈."
arctic_b0307,train,"We got few vegetables and fruits, and became fish eaters.","we got few vegetables and fruits, and became fish eaters.","वी गॉट फ्यू वेजिटेबल्स एंड फ्रूट्स, एंड बिकेम फिश ईटर्स.","위 갓 퓨 베지터블스 앤드 프루츠, 앤드 비케임 피쉬 이터즈."
arctic_b0308,train,We never made another migration.,we never made another migration.,वी नेवर मेड अनदर माइग्रेशन.,위 네버 메이드 어나더 마이그레이션.
arctic_b0309,train,Nor was Elam Harnish an exception.,nor was elam harnish an exception.,नॉर वज़ इलैम हार्निश अन एक्सेप्शन.,노어 워즈 일램 하니쉬 안 엑셉션.
arctic_b0310,train,"A little treatment, massage, with some help from the doctor.","a little treatment, massage, with some help from the doctor.","अ लिटल ट्रीटमेंट, मसाज, विद सम हेल्प फ्रॉम द डॉक्टर.","아 리틀 트리트먼트, 마사지, 위드 썸 헬프 프롬 더 닥터."
arctic_b0311,train,The 29th very foggy.,the 29th very foggy.,द ट्वेन्टी-नाइन्थ वेरी फॉगी.,더 트웬티나인쓰 베리 포기.
arctic_b0312,train,"Dig in; you're sure good, was Daylight's answer.","dig in you are sure good, was daylight's answer.","डिग इन यू आर शुर गुड, वज़ डेलाइट्स ऐंसर.","딕 인 유 아 슈어 굿, 워즈 데이라이츠 앤서."
arctic_b0313,train,The apron string loomed near and he shied like an unbroken colt.,the apron string loomed near and he shied like an unbroken colt.,दि एप्रन स्ट्रिंग लूम्ड निअर ऐंड ही शाइड लाइक अन अनब्रोकन कोल्ट.,디 에이프론 스트링 룸드 니어 앤드 히 샤이드 라이크 안 언브로큰 콜트.
arctic_b0314,train,He had been born with this endowment.,he had been born with this endowment.,ही हैड बीन बॉर्न विद धिस एंडाउमेंट.,히 해드 빈 본 위드 디스 엔다우먼트.
arctic_b0315,train,And this was their sole conversation throughout the meal.,and this was their sole conversation throughout the meal.,ऐंड दिस वज़ धेर सोल कन्वर्सेशन थ्रूआउट द मील.,앤드 디스 워즈 데어 솔 컨버세이션 쓰루아웃 더 밀.
arctic_b0316,test,"Though the aurora still flamed, another day had begun.","though the aurora still flamed, another day had begun.","दो दि औरोरा स्टिल फ्लेम्ड, अनदर डे हैड बिगन.","도 디 오로라 스틸 플레임드, 어나더 데이 해드 비건."
arctic_b0317,test,He did not believe in the burning of daylight for such a luxury.,he did not believe in the burning of daylight for such a luxury.,ही डिड नॉट बिलीव इन द बर्निंग अव डेलाइट फॉर सच अ लक्ज़री.,히 딛 낫 빌리브 인 더 버닝 오브 데이라이트 포 서치 아 럭셔리.
arctic_b0318,test,Again he had done the big thing.,again he had done the big thing.,अगेन ही हैड डन द बिग थिंग.,어게인 히 해드 던 더 빅 띵.
arctic_b0319,train,"Daylight was tired, profoundly tired.","daylight was tired, profoundly tired.","डेलाइट वस टायर्ड, प्रफाउंडली टायर्ड.","데이라이트 워즈 타이어드, 프로파운들리 타이어드."
arctic_b0320,train,The regret in his voice was provocative of a second burst of laughter.,the regret in his voice was provocative of a second burst of laughter.,द रिग्रेट इन हिस वॉइस वस प्रवोकटिव अव अ सेकंड बर्स्ट अव लाफ्टर.,더 리그렛 인 히즈 보이스 워즈 프로바커티브 오브 아 세컨드 버스트 오브 래프터.
arctic_b0321,train,"Instead, he arrived on the night of the second day.","instead, he arrived on the night of the second day.","इंस्टेड, ही अराइव्ड ऑन द नाइट अव द सेकंड डे.","인스테드, 히 어라이브드 온 더 나잇 어브 더 세컨드 데이."
arctic_b0322,train,Their supply of grub was gone.,their supply of grub was gone.,देर सप्लाई अव ग्रब वस गॉन.,데얼 서플라이 어브 그럽 워즈 곤.
arctic_b0323,train,"Crickets began to chirp, and more geese and ducks flew overhead.","crickets began to chirp, and more geese and ducks flew overhead.","क्रिकेट्स बिगैन टू चिरप, ऐंड मोर गीस ऐंड डक्स फ्लू ओवरहेड.","크리켓츠 비갠 투 칩, 앤드 모어 기스 앤드 덕스 플루 오버헤드."
arctic_b0324,train,Not till the twentieth of May did the river break.,not till the twentieth of may did the river break.,नॉट टिल द ट्वेंटीएथ अव मे डिड द रिवर ब्रेक.,낫 틸 더 투엔티에쓰 어브 메이 딛 더 리버 브레이크.
arctic_b0325,test,It was a gigantic inadequacy.,it was a gigantic inadequacy.,इट वज़ अ जायगैंटिक इनैडिक्वेसी.,잇 워즈 아 자이갠틱 인애드퀘시.
arctic_b0326,train,Our Mr Howison will call upon you at your hotel.,our mister howison will call upon you at your hotel.,आउर मिस्टर हाउइसन विल कॉल अपॉन यू ऐट योर होटेल.,아워 미스터 하우이슨 윌 콜 어폰 유 앳 유어 호텔.
arctic_b0327,train,He had been so easy.,he had been so easy.,ही हैड बिन सो ईज़ी.,히 핻 빈 소 이지.
arctic_b0328,train,"Change chairs, Daylight commanded.","change chairs, daylight commanded.","चेंज चेयर्स, डेलाइट कमांडेड.","체인지 체어즈, 데이라이트 커맨디드."
arctic_b0329,train,I'd sooner have my chips back.,i would sooner have my chips back.,आई वुड सूनर हैव माई चिप्स बैक.,아이 우드 수너 해브 마이 칩스 백.
arctic_b0330,train,They only had a little thirty thousand dollar fire.,they only had a little thirty thousand dollar fire.,थे ओनली हैड अ लिटल थर्टी थाउज़ंड डॉलर फायर.,데이 온리 해드 아 리틀 써티 싸우전드 달러 파이어.
arctic_b0331,train,His partners had starved and died on the Stewart.,his partners had starved and died on the stewart.,हिस पार्टनर्स हैड स्टार्व्ड ऐंड डाइड ऑन द स्टीवर्ट.,히즈 파트너즈 햇 스타브드 앤드 다이드 온 더 스튜어트.
arctic_b0332,train,"As to how she dressed, he had no ideas at all.","as to how she dressed, he had no ideas at all.","ऐस टू हाउ शी ड्रेस्ट, ही हैड नो आइडियाज़ ऐट ऑल.","애즈 투 하우 시 드레스트, 히 해드 노 아이디어스 앳 올."
arctic_b0333,dev,"It does, was her audacious answer.","it does, was her audacious answer.","इट डज़, वज हर ऑडेशस ऐन्सर.","잇 더즈, 워즈 허 오데이셔스 앤서."
arctic_b0334,train,"Oh, it's just a novel, a love story.","oh, it's just a novel, a love story.","ओ, इट्स जस्ट अ नॉवेल, अ लव स्टोरी.","오, 잇츠 저스트 아 노블, 아 러브 스토리."
arctic_b0335,train,Whoever lived on the ranch did that.,whoever lived on the ranch did that.,हूएवर लिव्ड ऑन द रैंच डिड दैट.,후에버 리브드 온 더 랜치 디드 댓.
arctic_b0336,dev,"How old are you, mother.","how old are you, mother.","हाउ ओल्ड आर यू, मदर.","하우 올드 아르 유, 머더."
arctic_b0337,train,Here he got a fresh thrill.,here he got a fresh thrill.,हीर ही गॉट अ फ्रेश थ्रिल.,히어 히 갓 아 프레시 쓰릴.
arctic_b0338,train,"It was unobtrusive, yet it was there.","it was unobtrusive, yet it was there.","इट वज़ अनअबट्रूसिव, येट इट वज़ देर.","잇 와즈 언어브트루시브, 옛 잇 와즈 데어."
arctic_b0339,test,"Well, I'll be plumb gosh darned.","well, i will be plumb gosh darned.","वेल, आई विल बी प्लम गॉश डार्न्ड.","웰, 아이 윌 비 플럼 가쉬 다른드."
arctic_b0340,train,These quick little joys of hers were sources of joy to him.,these quick little joys of hers were sources of joy to him.,दीज़ क्विक लिटल जॉइज़ अव हर्स वेर सोर्सिज़ अव जॉय टू हिम.,디즈 퀵 리틀 조이즈 오브 허즈 워 소시즈 오브 조이 투 힘.
arctic_b0341,train,I play that choice wide open to win.,i play that choice wide open to win.,आई प्ले दैट चॉइस वाइड ओपन टू विन.,아이 플레이 댓 초이스 와이드 오픈 투 윈.
arctic_b0342,train,Each improvement makes the value of everything else pump up.,each improvement makes the value of everything else pump up.,ईच इम्प्रूवमेंट मेक्स द वैल्यू अव एवरीथिंग एल्स पम्प अप.,이치 임프루브먼트 메익스 더 밸류 어브 에브리씽 엘스 펌프 업.
arctic_b0343,train,But how are you going to do it.,but how are you going to do it.,बट हाउ आर यू गोइंग टू डू इट.,벗 하우 아르 유 고잉 투 두 잇.
arctic_b0344,train,Lots of men take women buggy riding.,lots of men take women buggy riding.,लॉट्स ऑफ मेन टेक विमेन बगी राइडिंग.,라츠 어브 멘 테이크 위민 버기 라이딩.
arctic_b0345,train,"Daylight made no answer, and the door closed behind him.","daylight made no answer, and the door closed behind him.","डेलाइट मेड नो आंसर, ऐंड द डोर क्लोज़्ड बिहाइंड हिम.","데이라이트 메이드 노 앤서, 앤드 더 도어 클로즈드 비하인드 힘."
arctic_b0346,train,There's not an iota of truth in it.,there's not an iota of truth in it.,देरज़ नाट अन आयोरा अव ट्रूथ इन इट.,데얼즈 낫 안 아이오타 어브 트루스 인 잇.
arctic_b0347,train,But ever his gaze returned to that Crouched Venus on the piano.,but ever his gaze returned to that crouched venus on the piano.,बट एवर हिज गैज़ रिटर्न्ड टू दैट क्राउच्ड वीनस ऑन द पियानो.,벗 에버 히즈 게이즈 리턴드 투 댓 크라우치드 비너스 온 더 피아노.
arctic_b0348,train,Would you be satisfied with that one hundredth part of me.,would you be satisfied with that one hundredth part of me.,वुड यू बी सैटिस्फाइड विथ दैट वन हंड्रेडथ पार्ट अव मी.,우드 유 비 새티스파이드 위드 댓 원 헌드레드 파트 오브 미.
arctic_b0349,train,In such a tumbling of values was no time to sell.,in such a tumbling of values was no time to sell.,इन सच अ टम्बलिंग अव वैल्यूज़ वज़ नो टाइम टू सेल.,인 서치 아 텀블링 오브 밸류즈 워즈 노 타임 투 셀.
arctic_b0350,train,Stand off butcher and baker and all the rest.,stand off butcher and baker and all the rest.,स्टैंड ऑफ बुचर ऐंड बेकर ऐंड ऑल द रेस्ट.,스탠드 오프 부처 앤드 베이커 앤드 올 더 레스트.
arctic_b0351,train,"Matthewson, who's this bookkeeper, Rogers.","matthewson, who's this bookkeeper, rogers.","मैथ्यूसन, हूज़ दिस बुककीपर, रॉजर्स.","매튜슨, 후즈 디스 북키퍼, 로저스."
arctic_b0352,train,Now just what do you want to know.,now just what do you want to know.,नाउ जस्ट वट डू यू वांट टू नो.,나우 저스트 왓 두 유 원트 투 노우.
