File ID,Data Split,Original English,English,Hindi,Korean
arctic_a0510,train,Much more Ernest told them of themselves and of his disillusionment.,much more ernest told them of themselves and of his disillusionment.,मच मोर अर्नेस्ट टोल्ड देम अव धेम्सेल्व्स ऐंड अव हिज डिसिलुजनमेंट.,머치 모어 어니스트 톨드 뎀 어브 뎀셀브즈 앤드 어브 히즈 디스일루전먼트.
arctic_a0511,test,There is more behind this than a mere university ideal.,there is more behind this than a mere university ideal.,देयर इज़ मोर बिहाइंड दिस धन अ मेर यूनिवर्सिटी आइडियल.,데어 이즈 모어 비하인드 디스 댄 아 미어 유니버시티 아이디얼.
arctic_a0512,train,"No, it is a palace, wherein there are many servants.","no, it is a palace, wherein there are many servants.","नो, इट इज अ पैलेस, वेरिन देर आर मेनी सर्वेंट्स.","노, 잇 이즈 아 펠리스, 웨어린 데어 아 매니 서번츠."
arctic_a0513,train,We must give ourselves and not our money alone.,we must give ourselves and not our money alone.,वी मस्ट गिव आउर्सेल्व्ज़ ऐंड नॉट आउर मनी अलोन.,위 머스트 기브 아워셀브즈 앤드 낫 아워 머니 얼론.
arctic_a0514,train,We are consumed in our own flesh-pots.,we are consumed in our own flesh-pots.,वी आर कंस्यूम्ड इन आउर ओन फ्लेश्पॉट्स.,위 아 컨슘드 인 아우어 온 플레쉬포츠.
arctic_a0515,train,But here amongst ourselves let us speak out.,but here amongst ourselves let us speak out.,बट हीर अमंगस्ट आउर्सेल्व्ज़ लेट अस स्पीक आउट.,벗 히어 어몽스트 아우셀브즈 렛 어스 스피크 아웃.
arctic_a0516,dev,"Also, there was awe in their faces.","also, there was awe in their faces.","आल्सो, देर वस ऑ इन देर फेसिज़.","알소, 데어 워즈 오 인 데어 페이시즈."
arctic_a0517,train,Out of abstractions Ernest had conjured a vision and made them see it.,out of abstractions ernest had conjured a vision and made them see it.,आउट अव एब्स्ट्रैक्शंस अर्नेस्ट हैड कंजर्ड अ विजन एंड मेड देम सी इट.,아웃 어브 앱스트랙션즈 어니스트 해드 컨저드 아 비전 앤드 메이드 뎀 씨 잇.
arctic_a0518,train,Illuminating oil was becoming all profit.,illuminating oil was becoming all profit.,इलूमिनेटिंग ऑइल वस बिकमिंग ऑल प्रॉफिट.,일루미네이팅 오일 워즈 비커밍 올 프로핏.
arctic_a0519,train,Such an act was in direct violation of the laws of the land.,such an act was in direct violation of the laws of the land.,सच अन ऐक्ट वज़ इन डाइरेक्ट वायलेशन अव द लॉज अव द लैंड.,서치 안 액트 워즈 인 디렉트 바이올레이션 오브 더 로즈 오브 더 랜드.
arctic_a0520,train,He was fond of quoting a fragment from a certain poem.,he was fond of quoting a fragment from a certain poem.,ही वज़ फॉन्ड ऑव क्वोटिंग अ फ्रैगमेंट फ्रॉम अ सर्टन पोएम.,히 워즈 폰드 어브 쿼팅 아 프래그먼트 프럼 아 서튼 포엠.
arctic_a0521,train,Without them he could not run his empire.,without them he could not run his empire.,विदआउट थेम ही कुड नाट रन हिस एम्पायर.,위다우트 뎀 히 쿠드 낫 런 히즈 엠파이어.
arctic_a0522,train,For such countries nothing remained but reorganization.,for such countries nothing remained but reorganization.,फॉर सच कंट्रीज नथिंग रिमेन्ड बट रीऑर्गनाइज़ेशन.,포어 서치 컨트리즈 너씽 리메인드 벗 리오거나이제이션.
arctic_a0523,train,They could not continue their method of producing surpluses.,they could not continue their method of producing surpluses.,थे कुद नाट कंटिन्यू देर मेथड अव प्रोड्यूसिंग सर्प्लसेज़.,데이 쿨드 낫 컨티뉴 데어 메소드 어브 프로듀싱 서플러스.
arctic_a0524,train,At once would be instituted a dozen cooperative commonwealth states.,at once would be instituted a dozen cooperative commonwealth states.,एट वन्स वुड बी इंस्टिट्यूटिड अ डजन कोऑपरेटिव कामनवेल्थ स्टेट्स.,앳 원스 우드 비 인스티튜티드 아 더즌 코오퍼러티브 커먼웰스 스테이츠.
arctic_a0525,train,"The Oligarchy wanted violence, and it set its agents provocateurs to work.","the oligarchy wanted violence, and it set its agents provocateurs to work.","दि ऑलिगार्की वॉन्टेड वायलेन्स, एंड इट सेट इट्स एजेंट्स प्रोवोकटर्स टू वर्क.","디 알리거키 원티드 바이얼런스, 앤드 잇 셋 잇츠 에이전츠 프로보카터즈 투 워크."
arctic_a0526,dev,Nowhere did the raw earth appear.,nowhere did the raw earth appear.,नोवेर डिड द रॉ अर्थ अपीर.,노웨어 디드 더 로 어스 어피어.
arctic_a0527,train,The lush vegetation of that sheltered spot make a natural shield.,the lush vegetation of that sheltered spot make a natural shield.,द लश वेजिटेशन अव दैट शेल्टर्ड स्पॉट मेक अ नैचरल शील्ड.,더 러쉬 베지테이션 어브 댓 쉘터드 스팟 메이크 아 내츄럴 쉴드.
arctic_a0528,train,"Men who endure it, call it living death.","men who endure it, call it living death.","मेन हू एंड्यूर इट, कॉल इट लिविंग डेथ.","멘 후 엔두르 잇, 콜 잇 리빙 데스."
arctic_a0529,dev,"As I say, he had tapped the message very rapidly.","as i say, he had tapped the message very rapidly.","ऐज़ आई से, ही हैड टैप्ट द मैसेज वेरी रैपिडली.","애즈 아이 세이, 히 해드 탭트 더 메시지 베리 래피들리."
arctic_a0530,train,"Ask him, I laughed, then turned to Pasquini.","ask him, i laughed, then turned to pasquini.","आस्क हिम, आई लाफ्ड, धेन टर्न्ड टू पैस्क्वीनी.","애스크 힘, 아이 래프드, 덴 턴드 투 파스크위니."
arctic_a0531,train,In what bucolic school of fence he had been taught was beyond imagining.,in what bucolic school of fence he had been taught was beyond imagining.,इन वट ब्यूकालिक स्कूल अव फेंस ही हैड बीन टॉट वॉज बियॉन्ड इमेजिनिंग.,인 왓 뷰콜릭 스쿨 어브 펜스 히 해드 빈 톳 워즈 비욘드 이미지닝.
arctic_a0532,train,May drought destroy your crops.,may drought destroy your crops.,मे ड्राउट डिस्ट्रॉय योर क्रॉप्स.,메이 드라우트 디스트로이 유어 크롭스.
arctic_a0533,train,"Dunham, can your boy go along with Jesse.","dunham, can your boy go along with jesse.","डनम, कैन यूर बॉय गो अलॉंग विथ जेसी.","던햄, 캔 유어 보이 고 얼롱 위드 제시."
arctic_a0534,train,"But Johannes could, and did.","but johannes could, and did.","बट जोहान्स कुड, ऐंड डिड.","벗 조한스 쿧, 앤드 딛."
arctic_a0535,train,A new preacher and a new doctrine come to Jerusalem.,a new preacher and a new doctrine come to jerusalem.,अ न्यू प्रीचर एंड अ न्यू डॉक्ट्रिन कम टू जेरूसलम.,아 뉴 프리처 앤드 아 뉴 닥트린 컴 투 제루살렘.
arctic_a0536,train,He would destroy all things that are fixed.,he would destroy all things that are fixed.,ही वूड डिस्ट्रॉय ऑल थिंग्स दैट आर फिक्स्ड.,히 우드 디스트로이 올 띵스 댓 아 픽스트.
arctic_a0537,train,He was an enthusiast and a desert dweller.,he was an enthusiast and a desert dweller.,ही वज़ अन एन्थुज़ीऐस्ट ऐन्ड अ डेज़र्ट ड्वेलर.,히 워즈 안 엔뚜지애스트 앤드 아 데저트 드웰러.
arctic_a0538,test,"What Pascal glimpsed with the vision of a seer, I have lived.","what pascal glimpsed with the vision of a seer, i have lived.","वट पैस्कल ग्लिम्प्स्ड विथ द विजन अव अ सीर, आई हैव लिव्ड.","왓 파스칼 글림스드 위드 더 비전 어브 아 시어, 아이 해브 리브드."
arctic_a0539,train,I should like to engage just for one whole life in that.,i should like to engage just for one whole life in that.,आई शुद लाइक टू एंगेज जस्ट फॉर वन होल लाइफ इन दैट.,아이 슈드 라이크 투 엔게이지 저스트 포어 원 홀 라이프 인 댓.
arctic_a0540,train,"Yea, so are all the lesser animals of today clean.","yea, so are all the lesser animals of today clean.","ये, सो आर ऑल द लेसर एनिमल्स अव टुडे क्लीन.","예이, 소 아르 올 더 레서 애니멀즈 어브 투데이 클린."
arctic_a0541,train,The Warden with a quart of champagne.,the warden with a quart of champagne.,द वॉर्डन विथ अ क्वार्ट अव शैम्पेन.,더 워든 위드 아 쿼트 오브 샴페인.
arctic_a0542,train,"Without a doubt, some of them have dinner engagements.","without a doubt, some of them have dinner engagements.","विदआउट अ डाउट, सम अव देम हैव डिनर एंगेजमेंट्स.","위드아웃 아 다우트, 썸 업 뎀 해브 디너 엔게이지먼츠."
arctic_a0543,train,"I had been born with no organic, chemical predisposition toward alcohol.","i had been born with no organic, chemical predisposition toward alcohol.","आई हैड बिन बॉर्न विथ नो ऑर्गैनिक, केमिकल प्रेडिस्पोज़िशन टुवॉर्ड अल्कोहल.","아이 해드 빈 본 위드 노 오가닉, 케미컬 프리디스포지션 투워드 알코올."
arctic_a0544,test,He may anticipate the day of his death.,he may anticipate the day of his death.,ही मे एंटिसिपेट द डे अव हिज़ डेथ.,히 메이 앤티시페이트 더 데이 어브 히즈 데스.
arctic_a0545,test,The Italian rancho was a bachelor establishment.,the italian rancho was a bachelor establishment.,दि इटैलियन रैंचो वस अ बैचलर एस्टैब्लिश्मेंट.,디 이탈리안 랜초 워즈 아 배철러 이스타블리시먼트.
arctic_a0546,train,I lost my balance and pitched head foremost into the ooze.,i lost my balance and pitched head foremost into the ooze.,आई लॉस्ट माई बैलेंस एंड पिच्ड हेड फॉरमोस्ट इंटू दि ऊज़.,아이 로스트 마이 밸런스 앤드 피치드 헤드 포어모스트 인투 디 우즈.
arctic_a0547,train,Men like Joe Goose dated existence from drunk to drunk.,men like joe goose dated existence from drunk to drunk.,मेन लाइक जो गूस डेटेड एग्जिस्टेंस फ्रॉम ड्रंक टू ड्रंक.,맨 라이크 조 구스 데이티드 엑지스턴스 프럼 드렁크 투 드렁크.
arctic_a0548,train,"Also, churches and preachers I had never known.","also, churches and preachers i had never known.","ऑल्सो, चर्चिज़ ऐंड प्रीचर्स आई हैड नेवर नोन.","알소, 처치스 앤드 프리처즈 아이 해드 네버 노운."
arctic_a0549,train,Do you know that we weigh every pound of coal we burn.,do you know that we weigh every pound of coal we burn.,डू यू नो दॅट वी वे एवरी पाउंड अव कोल वी बर्न.,두 유 노 댓 위 웨이 에브리 파운드 어브 콜 위 번.
arctic_a0550,train,This also became part of the daily schedule.,this also became part of the daily schedule.,दिस आल्सो बिकेम पार्ट अव द डेली स्केड्यूल.,디스 알소 비케임 파트 어브 더 데일리 스케줄.
arctic_a0551,train,All an appearance can know is mirage.,all an appearance can know is mirage.,ऑल अन अपीअरन्स कैन नो इज़ मिराज.,올 안 어피어런스 캔 노 이즈 미라지.
arctic_a0552,test,"Yet he dreams he is immortal, I argue feebly.","yet he dreams he is immortal, i argue feebly.","येट ही ड्रीम्ज़ ही इज़ इमॉर्टल, आई आर्ग्यू फीब्ली.","옛 히 드림즈 히 이즈 이모털, 아이 아규 피블리."
arctic_a0553,dev,"I am writing these lines in Honolulu, Hawaii.","i am writing these lines in honolulu, hawaii.","आई ऐम राइटिंग दीज लाइन्स इन होनोलूलू, हवाई.","아이 앰 라이팅 디즈 라인즈 인 호놀룰루, 하와이."
arctic_a0554,train,"Jack London, Waikiki Beach, Honolulu, Oahu.","jack london, waikiki beach, honolulu, oahu.","जैक लंदन, वैकिकी बीच, होनोलूलू, ओआहू.","잭 런던, 와이키키 비치, 호놀룰루, 오아후."
arctic_a0555,dev,Jerry was so secure in his nook that he did not roll away.,jerry was so secure in his nook that he did not roll away.,जेरी वज़ सो सिक्योर इन हिस नुक दैट ही डिड नॉट रोल अवे.,제리 워즈 소 시큐어 인 히즈 눅 댓 히 디드 낫 롤 어웨이.
arctic_a0556,test,"Why, he's bought forty pounds of goods from you already.","why, he's bought forty pounds of goods from you already.","वाई, हीज़ बॉट फॉर्टी पाउंड्स अव गुड्स फ्रॉम यू ऑलरेडी.","와이, 히즈 보트 포티 파운즈 오브 굿즈 프럼 유 올레디."
arctic_a0557,train,The last refugee had passed.,the last refugee had passed.,द लास्ट रेफ्यूजी हैड पास्ट.,더 라스트 레퓨지 해드 패스트.
arctic_a0558,train,"And the foundation stone of service, in his case, was obedience.","and the foundation stone of service, in his case, was obedience.","ऐंड द फाउंडेशन स्टोन अव सर्विस, इन हिज़ केस, वॉज़ ओबीडिएंस.","앤드 더 파운데이션 스톤 오브 서비스, 인 히즈 케이스, 워즈 오비디언스."
arctic_a0559,train,Peace be unto you and grace before the Lord.,peace be unto you and grace before the lord.,पीस बी अंतु यू एंड ग्रेस बिफोर द लॉर्ड.,피스 비 언투 유 앤드 그레이스 비포어 더 로드.
arctic_a0560,test,His mouth opened; words shaped vainly on his lips.,his mouth opened words shaped vainly on his lips.,हिज़ माउथ ओपेंड वर्ड्स शेप्ड वेनली ऑन हिज़ लिप्स.,히스 마우스 오픈드 워즈 쉐이프트 베인리 온 히스 립스.
arctic_a0561,test,"Bill lingered, contemplating his work with artistic appreciation.","bill lingered, contemplating his work with artistic appreciation.","बिल लिंगर्ड, कांटेम्प्लेटिंग हिज़ वर्क विथ आर्टिस्टिक अप्रीशियेशन.","빌 링거드, 컨템플레이팅 히즈 워크 위드 아티스틱 어프리시에이션."
arctic_a0562,train,What the flaming.,what the flaming.,व्हट द फ्लेमिंग.,왓 더 플레밍.
arctic_a0563,test,Mrs McFee's jaws brought together with a snap.,missus mcfee's jaws brought together with a snap.,मिसस मैकफ़ीज़ जॉज़ ब्रॉट टुगेदर विथ अ स्नैप.,미서스 맥피즈 죠즈 브로트 투게더 위드 아 스냅.
arctic_a0564,train,"Then it is as I said, Womble announced with finality.","then it is as i said, womble announced with finality.","देन इट इस ऐज़ आई सेड, वॉम्बल अनाउन्स्ड विद फाइनलिटी.","덴 잇 이즈 애즈 아이 세드, 웜블 어나운스트 위드 파이낼리티."
arctic_a0565,train,"With them were Indians, also three other men.","with them were indians, also three other men.","विथ देम वर इंडियंस, आल्सो थ्री अदर मेन.","위드 뎀 워 인디언스, 알소 쓰리 어더 멘."
arctic_a0566,train,Dennin's hands were released long enough for him to sign the document.,dennin's hands were released long enough for him to sign the document.,डेनिन्स हैंड्स वर रिलीस्ड लॉन्ग इनफ फॉर हिम टू साइन द डॉक्यूमेंट.,덴닌즈 핸즈 워 릴리스드 롱 이너프 포어 힘 투 사인 더 다큐먼트.
arctic_a0567,train,"Now Irvine was a man of impulse, a poet.","now irvine was a man of impulse, a poet.","नाउ अर्वाइन वज अ मैन अव इम्पल्स, अ पोएट.","나우 어바인 워즈 아 맨 어브 임펄스, 아 포잇."
arctic_a0568,train,"He was just bursting with joy, joy over what.","he was just bursting with joy, joy over what.","ही वज़ जस्ट बर्स्टिंग विथ जॉय, जॉय ओवर वट.","히 워즈 저스트 버스팅 위드 조이, 조이 오버 왓."
arctic_a0569,train,"At Lake Linderman I had one canoe, very good Peterborough canoe.","at lake linderman i had one canoe, very good peterborough canoe.","ऐट लेक लिन्डर्मन आई हैड वन कनू, वेरी गुड पीटरबरो कनू.","앳 레이크 린더먼 아이 해드 원 카누, 베리 굿 피터버러 카누."
arctic_a0570,train,Behind him lay the thousand-years-long road across all Siberia and Russia.,behind him lay the thousand-years-long road across all siberia and russia.,बिहाइंड हिम ले द थाउज़ंड-ईयरज़-लॉन्ग रोड अक्रॉस आल साइबेरिया एंड रशिया.,비하인드 힘 레이 더 싸우쟌지이얼즈롱 로드 어크로스 올 사이베리아 앤드 러시아.
arctic_a0571,train,He had forgotten to build a fire and thaw out.,he had forgotten to build a fire and thaw out.,ही हैड फरगाटन टू बिल्ड अ फायर ऐंड थॉ आउट.,히 핻 포거튼 투 빌드 아 파이어 앤드 쏘 아웃.
arctic_a0572,train,I never saw anything like her in my life.,i never saw anything like her in my life.,आई नेवर सॉ एनीथिंग लाइक हर इन माई लाइफ.,아이 네버 소 에니씽 라이크 허 인 마이 라이프.
arctic_a0573,train,There was no law on the Yukon save what they made for themselves.,there was no law on the yukon save what they made for themselves.,धेर वज़ नो लॉ ऑन द यूकन सेव वट थे मेड फॉर देम्सेल्व्ज.,데어 워즈 노 로 온 더 유콘 세이브 왓 데이 메이드 포어 뎀셀브즈.
arctic_a0574,train,"Good business man, Curly, O'Brien was saying.","good business man, curly, o'brien was saying.","गुड बिज़नेस मैन, कर्ली, ओ'ब्रायन वस सेइंग.","굿 비즈니스 맨, 컬리, 오브라이언 워즈 세잉."
arctic_a0575,train,"There weren't any missions, and he was the man to know.","there were not any missions, and he was the man to know.","दैर वर नाट एनी मिशन्स, ऐंड ही वज़ द मैन टू नो.","데어 워 낫 애니 미션즈, 앤드 히 워즈 더 맨 투 노우."
arctic_a0576,train,And the big Persian knew of his existence before he did of hers.,and the big persian knew of his existence before he did of hers.,ऐंड द बिग पर्शियन न्यू अव हिज़ एक्ज़िस्टेंस बिफोर ही डिड अव हर्स.,앤드 더 빅 퍼션 뉴 어브 히즈 이그지스턴스 비포어 히 디드 어브 허즈.
arctic_a0577,train,"Once the jews harp began emitting its barbaric rhythms, Michael was helpless.","once the jews harp began emitting its barbaric rhythms, michael was helpless.","वन्स द जूज़ हार्प बिगैन इमिटिंग इट्स बारबरिक रिदम्स, माइकल वज़ हेल्पलेस.","원스 더 쥬스 하프 비갠 이밋팅 잇츠 바바릭 리듬즈, 마이클 워즈 헬플리스."
arctic_a0578,train,But we'll just postpone this.,but we will just postpone this.,बट वी विल जस्ट पोस्टपोन दिस.,벗 위 윌 저스트 포스트폰 디스.
arctic_a0579,train,There was the Emma Louisa.,there was the emma louisa.,देर वज़ दि एमा लुइसा.,데어 워즈 디 엠마 루이사.
arctic_a0580,train,This is my fifth voyage.,this is my fifth voyage.,दिस इस माय फिफ्थ वॉयज.,디스 이즈 마이 피프스 보이지.
arctic_a0581,train,It was this proposition that started the big idea in Daughtry's mind.,it was this proposition that started the big idea in daughtry's mind.,इट वज़ दिस प्रपोजिशन दैट स्टार्टेड द बिग आइडिया इन डॉटरिज माइंड.,잇 워즈 디스 프로포지션 댓 스타티드 더 빅 아이디어 인 도트리즈 마인드.
arctic_a0582,train,Daughtry elaborated on the counting trick by bringing Cocky along.,daughtry elaborated on the counting trick by bringing cocky along.,डॉट्री इलैबरेटेड ऑन द काउंटिंग ट्रिक बाई ब्रिंगिंग कॉकी अलांग.,도트리 일래보레티드 온 더 카운팅 트릭 바이 브링잉 코키 얼롱.
arctic_a0583,train,"Enjoy it he did, but principally for Steward's sake.","enjoy it he did, but principally for steward's sake.","एन्जॉय इट ही डिड, बट प्रिंसिपली फॉर स्ट्यूअर्ड्स सेक.","엔조이 잇 히 디드, 벗 프린시펄리 포 스튜어즈 세이크."
arctic_a0584,train,I have long noted your thirst unquenchable.,i have long noted your thirst unquenchable.,आई हैव लॉन्ग नोटेड योर थर्स्ट अनक्वेंचबल.,아이 해브 롱 노티드 유어 서스트 언퀜처블.
arctic_a0585,train,"Wonder if he's a lion dog, Charles suggested.","wonder if he's a lion dog, charles suggested.","वंडर इफ हीज़ अ लायन डॉग, चार्ल्स सजेस्टेड.","원더 이프 히즈 아 라이언 도그, 찰스 서제스티드."
arctic_a0586,train,We don't see ourselves as foolish.,we do not see ourselves as foolish.,वी डू नाट सी आइउर्सेल्व्ज़ ऐज़ फूलिश.,위 두 낫 시 아이얼브즈 애즈 풀리쉬.
arctic_a0587,train,He had comparatively no advantages at first.,he had comparatively no advantages at first.,ही हैड कम्परेटिवली नो एडवांटेजेस ऐट फर्स्ट.,히 핻 컴패러티블리 노 어드밴티지스 앳 퍼스트.
arctic_a0588,train,"He had proved it today, with his amateurish and sophomoric productions.","he had proved it today, with his amateurish and sophomoric productions.","ही हैड प्रूव्ड इट टुडे, विथ हिस अमेट्यूरिश एंड सोफोमोरिक प्रोडक्शन्स.","히 핫 프루브드 잇 투데이, 위드 히즈 에머츄리쉬 앤드 소포모릭 프러덕션즈."
arctic_a0589,train,"I was sick once, typhoid.","i was sick once, typhoid.","आई वस सिक वन्स, टाइफॉइड.","아이 워즈 식 원스, 타이포이드."
arctic_a0590,dev,In a way he is my protege.,in a way he is my protege.,इन अ वे ही इज़ माई प्रोटेज.,인 아 웨이 히 이즈 마이 프로테제.
arctic_a0591,train,We are both children together.,we are both children together.,वी आर बोथ चिल्ड्रेन टुगेदर.,위 아르 보스 칠드런 투게더.
