File ID,Data Split,Original English,English,Hindi,Korean
arctic_a0001,train,"Author of the danger trail, Philip Steels, etc.","author of the danger trail, philip steels, etc.","ऑथर अव द डेंजर ट्रेल, फिलिप स्टील्स, एट्सेट्रा.","어서 어브 더 데인저 트레일, 필립 스틸스, 엣세트라."
arctic_a0002,train,"Not at this particular case, Tom, apologized Whittemore.","not at this particular case, tom, apologized whittemore.","नॉट ऐट दिस पर्टिक्युलर केस, टॉम, अपालजाइज्ड विटिमोर.","낫 앳 디스 퍼티큘러 케이스, 탐, 어폴러자이즈드 위트모어."
arctic_a0003,train,For the twentieth time that evening the two men shook hands.,for the twentieth time that evening the two men shook hands.,फॉर द ट्वेंटीएथ टाइम दैट ईवनिंग द टू मेन शुक हैंड्स.,포어 더 트웬티엣 타임 댓 이브닝 더 투 멘 슉 핸즈.
arctic_a0004,train,"Lord, but I'm glad to see you again, Phil.","lord, but i am glad to see you again, phil.","लॉर्ड, बट आई ऐम ग्लैड टू सी यू अगेन, फिल.","로드, 벗 아이 앰 글래드 투 씨 유 어겐, 필."
arctic_a0005,train,Will we ever forget it.,will we ever forget it.,विल वी एवर फरगेट इट.,윌 위 에버 포겟 잇.
arctic_a0006,train,"God bless 'em, I hope I'll go on seeing them forever.","god bless 'em, i hope i will go on seeing them forever.","गॉड ब्लेस एम, आई होप आई विल गो ऑन सीइंग देम फॉरएवर.","갓 블레스 엠, 아이 호프 아이 윌 고 온 씨잉 뎀 포에버."
arctic_a0007,train,And you always want to see it in the superlative degree.,and you always want to see it in the superlative degree.,ऐंड यू ऑलवेज़ वांट टू सी इट इन द सुपरलैटिव डिग्री.,앤드 유 올웨이즈 원트 투 씨 잇 인 더 수펄러티브 디그리.
arctic_a0008,train,"Gad, your letter came just in time.","gad, your letter came just in time.","गैड, योर लेटर केम जस्ट इन टाइम.","갯, 유어 레터 케임 저스트 인 타임."
arctic_a0009,train,"He turned sharply, and faced Gregson across the table.","he turned sharply, and faced gregson across the table.","ही टर्न्ड शार्पली, ऐंड फेस्ड ग्रेगसन अक्रॉस द टेबल.","히 턴드 샤플리, 앤드 페이스드 그렉슨 어크로스 더 테이블."
arctic_a0010,train,I'm playing a single hand in what looks like a losing game.,i am playing a single hand in what looks like a losing game.,आई ऐम प्लेइंग अ सिंगल हैंड इन वट लुक्स लाइक अ लूजिंग गेम.,아이 앰 플레잉 아 싱글 핸드 인 왓 룩스 라이크 아 루징 게임.
arctic_a0011,train,If I ever needed a fighter in my life I need one now.,if i ever needed a fighter in my life i need one now.,इफ आई एवर नीडेड अ फाइटर इन माइ लाइफ आई नीड वन नाउ.,이프 아이 에버 니디드 아 파이터 인 마이 라이프 아이 니드 원 나우.
arctic_a0012,dev,Gregson shoved back his chair and rose to his feet.,gregson shoved back his chair and rose to his feet.,ग्रेगसन शव्ड बैक हिज चेयर ऐंड रोज़ टू हिज फीट.,그렉슨 셔브드 백 히즈 체어 앤드 로즈 투 히즈 피트.
arctic_a0013,train,"He was a head shorter than his companion, of almost delicate physique.","he was a head shorter than his companion, of almost delicate physique.","ही वज़ अ हेड शॉर्टर धन हिज कम्पैनियन, अव ऑलमोस्ट डेलिकेट फिजीक.","히 워즈 아 헤드 쇼터 댄 히즈 컴패니언, 어브 올모스트 델리켓 피지크."
arctic_a0014,train,"Now you're coming down to business, Phil, he exclaimed.","now you are coming down to business, phil, he exclaimed.","नाउ यू आर कमिंग डाउन टू बिजनेस, फिल, ही एक्सक्लेम्ड.","나우 유 아 커밍 다운 투 비즈니스, 필, 히 엑스클레임드."
arctic_a0015,train,It's the aurora borealis.,it's the aurora borealis.,इट्स दि औरोरा बोरेलिस.,잇츠 디 오로라 보리앨리스.
arctic_a0016,train,"There's Fort Churchill, a rifle-shot beyond the ridge, asleep.","there's fort churchill, a rifle-shot beyond the ridge, asleep.","देर्स फॉर्ट चर्चिल, अ राइफल-शॉट बियॉन्ड द रिज, अस्लीप.","데어즈 포트 처칠, 아 라이플샷 비욘드 더 리지, 어슬립."
arctic_a0017,train,From that moment his friendship for Belize turns to hatred and jealousy.,from that moment his friendship for belize turns to hatred and jealousy.,फ्रॉम धैट मोमेंट हिज फ्रेंडशिप फॉर बेलीज़ टर्न्स टू हेट्रेड एंड जेलसी.,프럼 댓 모먼트 히즈 프렌드십 포어 벨리즈 턴즈 투 헤이트리드 앤드 젤러시.
arctic_a0018,train,There was a change now.,there was a change now.,देयर वस अ चेंज नाउ.,데어 워즈 아 체인지 나우.
arctic_a0019,train,"I followed the line of the proposed railroad, looking for chances.","i followed the line of the proposed railroad, looking for chances.","आई फालोड द लाइन अव द प्रपोज़्ड रेलरोड, लुकिंग फॉर चांसेज़.","아이 팔로우드 더 라인 어브 더 프로포즈드 레일로드, 루킹 포 찬시즈."
arctic_a0020,dev,Clubs and balls and cities grew to be only memories.,clubs and balls and cities grew to be only memories.,क्लब्स ऐंड बॉल्स ऐंड सिटीज़ ग्रो टू बी ओनली मेमोरीज़.,클럽즈 앤드 볼즈 앤드 시티즈 그루 투 비 온리 메모리즈.
arctic_a0021,train,It fairly clubbed me into recognizing it.,it fairly clubbed me into recognizing it.,इट फेरली क्लब्ड मी इंटु रेकग्नाइजिंग इट.,잇 페얼리 클럽드 미 인투 레커그나이징 잇.
arctic_a0022,train,Hardly were our plans made public before we were met by powerful opposition.,hardly were our plans made public before we were met by powerful opposition.,हार्डली वर आवर प्लैन्स मेड पब्लिक बिफोर वी वर मेट बाय पावरफुल ऑपोज़िशन.,하드리 워 아워 플랜즈 메이드 퍼블릭 비포어 위 워 메트 바이 파워풀 오퍼지션.
arctic_a0023,train,A combination of Canadian capital quickly organized and petitioned for the same privileges.,a combination of canadian capital quickly organized and petitioned for the same privileges.,अ कॉम्बिनेशन अव कनेडियन कैपिटल क्विकली ऑर्गनाइज़्ड ऐंड पेटीशन्ड फॉर द सेम प्रिविलेजेस.,아 컴비네이션 오브 캐네이디언 캐피털 퀵클리 오르가나이즈드 앤드 퍼티션드 포어 더 세임 프리빌리지즈.
arctic_a0024,test,It was my reports from the north which chiefly induced people to buy.,it was my reports from the north which chiefly induced people to buy.,इट वज माई रिपोर्ट्स फ्रम द नॉर्थ विच चीफली इंड्यूस्ट पीपल टू बाई.,잇 워즈 마이 리포츠 프럼 더 노스 위치 치플리 인듀스트 피플 투 바이.
arctic_a0025,dev,I was about to do this when cooler judgment prevailed.,i was about to do this when cooler judgment prevailed.,आई वस अबाउट टू डू दिस वेन कूलर जजमेंट प्रिवेल्ड.,아이 워즈 어바웃 투 두 디스 웬 쿨러 저지먼트 프리베일드.
arctic_a0026,dev,It occurred to me that there would have to be an accounting.,it occurred to me that there would have to be an accounting.,इट अकर्ड टू मी दॅट धेर वुड हॅव टू बी अन अकाउंटिंग.,잇 어커드 투 미 댓 데어 우드 해브 투 비 안 어카운팅.
arctic_a0027,train,To my surprise he began to show actual enthusiasm in my favor.,to my surprise he began to show actual enthusiasm in my favor.,टू माई सरप्राइज ही बिगैन टू शो ऐक्चुअल एन्थुजियाज्म इन माई फेवर.,투 마이 서프라이즈 히 비갠 투 쇼 액추얼 엔수시아즘 인 마이 페이버.
arctic_a0028,train,"Robbery, bribery, fraud, ","robbery, bribery, fraud,","रॉबरी, ब्राइबरी, फ्रॉड,","로버리, 브라이버리, 프로드,"
arctic_a0029,test,Their forces were already moving into the north country.,their forces were already moving into the north country.,देर फोर्सेस वेर ऑलरेडी मूविंग इंटु द नॉर्थ कंट्री.,데어 포스 워 올레디 무빙 인투 더 노스 컨트리.
arctic_a0030,train,I had faith in them.,i had faith in them.,आई हैड फेथ इन देम.,아이 해드 페이스 인 뎀.
arctic_a0031,train,They were three hundred yards apart.,they were three hundred yards apart.,थे वर थ्री हन्ड्रेड यार्ड्स अपार्ट.,데이 워 쓰리 헌드레드 야즈 어파트.
arctic_a0032,train,Since then some mysterious force has been fighting us at every step.,since then some mysterious force has been fighting us at every step.,सिंस देन सम मिस्टीरियस फोर्स हैज बीन फाइटिंग अस ऐट एवरी स्टेप.,신스 덴 섬 미스테리어스 포스 해즈 빈 파이팅 어스 앳 에브리 스텝.
arctic_a0033,dev,"He unfolded a long typewritten letter, and handed it to Gregson.","he unfolded a long typewritten letter, and handed it to gregson.","ही अनफोल्डेड अ लॉंग टाइपरिटन लेटर, ऐंड हैंडेड इट टू ग्रेगसन.","히 언폴디드 아 롱 타이프리튼 레터, 앤드 핸디드 잇 투 그렉슨."
arctic_a0034,train,Men of Selden's stamp don't stop at women and children.,men of selden's stamp do not stop at women and children.,मेन अव सेल्डन स्टैम्प डू नाट स्टॉप ऐट विमिन ऐन्ड चिल्ड्रन.,멘 어브 셀든즈 스탬프 두 낫 스탑 앳 우먼 앤드 칠드런.
arctic_a0035,train,"He stopped, and Philip nodded at the horrified question in his eyes.","he stopped, and philip nodded at the horrified question in his eyes.","ही स्टॉप्ड, ऐंड फिलिप नॉडेड ऐट द हॉरिफाइड क्वेश्चन इन हिज आइज़.","히 스탑트, 앤드 필립 나디드 앳 더 호리파이드 퀘스천 인 히즈 아이즈."
arctic_a0036,train,She turned in at the hotel.,she turned in at the hotel.,शी टर्न्ड इन ऐट द होटल.,시 턴드 인 앳 더 호텔.
arctic_a0037,train,I was the only one who remained sitting.,i was the only one who remained sitting.,आई वज दि ओनली वन हू रिमेंड सिटिंग.,아이 워즈 디 온리 원 후 리메인드 시팅.
arctic_a0038,train,We'll have to watch our chances.,we will have to watch our chances.,वी विल हैव टू वॉच आवर चांसिस.,위 윌 해브 투 와치 아우어 챈시즈.
arctic_a0039,train,The ship should be in within a week or ten days.,the ship should be in within a week or ten days.,द शिप शुड बी इन विधिन अ वीक और टेन डेज.,더 쉽 슏 비 인 위딘 아 윅 오 텐 데이즈.
arctic_a0040,train,I suppose you wonder why she is coming up here.,i suppose you wonder why she is coming up here.,आई सपोज़ यू वंडर वाय शी इज़ कमिंग अप हियर.,아이 서포즈 유 원더 와이 쉬 이즈 커밍 업 히어.
arctic_a0041,train,Meanwhile I'll go out to breathe a spell.,meanwhile i will go out to breathe a spell.,मीनवाइल आई विल गो आउट टू ब्रीद अ स्पेल.,민와일 아이 윌 고 아웃 투 브리드 아 스펠.
arctic_a0042,dev,How could he explain his possession of the sketch.,how could he explain his possession of the sketch.,हाउ कुड ही एक्सप्लेन हिस पज़ेशन अव द स्केच.,하우 쿧 히 익스플레인 히즈 포세션 어브 더 스케치.
arctic_a0043,train,It seemed nearer to him since he had seen and talked with Gregson.,it seemed nearer to him since he had seen and talked with gregson.,इट सीम्ड नियर टू हिम सिंस ही हैड सीन एंड टॉक्ड विद ग्रेगसन.,잇 심드 니러 투 힘 신스 히 핫 신 앤드 톡트 위드 그렉슨.
arctic_a0044,train,Her own betrayal of herself was like tonic to Philip.,her own betrayal of herself was like tonic to philip.,हर ओन बिट्रेयल अव हर्सेल्फ वज़ लाइक टॉनिक टू फिलिप.,허 온 비트레이얼 어브 허셀프 워즈 라이크 토닉 투 필립.
arctic_a0045,train,He moved away as quietly as he had come.,he moved away as quietly as he had come.,ही मूव्ड अवे अज क्वाइटली अज ही हैड कम.,히 무브드 어웨이 애즈 콰이틀리 애즈 히 해드 컴.
arctic_a0046,train,"The girl faced him, her eyes shining with sudden fear.","the girl faced him, her eyes shining with sudden fear.","द गर्ल फेस्ड हिम, हर आइज़ शाइनिंग विद सडन फियर.","더 걸 페이스트 힘, 허 아이즈 샤이닝 위드 서든 피어."
arctic_a0047,train,Close beside him gleamed the white fangs of the wolf-dog.,close beside him gleamed the white fangs of the wolf-dog.,क्लोस बिसाइड हिम ग्लीम्ड द व्हाइट फैंग्स अव द वुल्फ-डॉग.,클로즈 비사이드 힘 글림드 더 화이트 팽즈 어브 더 울프도그.
arctic_a0048,train,"He looked at the handkerchief more, closely.","he looked at the handkerchief more, closely.","ही लुकट ऐट द हैंडकरचीफ मोर, क्लोसली.","히 룩트 앳 더 핸드커치프 모어, 클로슬리."
arctic_a0049,train,Gregson was asleep when he re-entered the cabin.,gregson was asleep when he re-entered the cabin.,ग्रेगसन वज़ अस्लीप वेन ही री-एंटर्ड द कैबिन.,그렉슨 워즈 어슬립 웬 히 리엔터드 더 캐빈.
arctic_a0050,train,In spite of their absurdity the words affected Philip curiously.,in spite of their absurdity the words affected philip curiously.,इन स्पाइट अव देर अबसर्डिटी द वर्ड्स अफेक्टेड फिलिप क्यूरियसली.,인 스파이트 어브 데어 앱설러티 더 워즈 어펙티드 필립 큐리어슬리.
arctic_a0051,train,"The lace was of a delicate ivory color, faintly tinted with yellow.","the lace was of a delicate ivory color, faintly tinted with yellow.","द लेस वज़ अव अ डेलिकेट आइवरी कलर, फेंटली टिन्टेड विथ येलो.","더 레이스 워즈 어브 아 델리컷 아이보리 컬러, 페인트리 틴티드 위드 옐로우."
arctic_a0052,train,It was a curious coincidence.,it was a curious coincidence.,इट वस अ क्यूरियस कोइंसिडेंस.,잇 워즈 아 큐리어스 코인시던스.
arctic_a0053,train,Suddenly his fingers closed tightly over the handkerchief.,suddenly his fingers closed tightly over the handkerchief.,सडनली हिस फिंगर्स क्लोज़्ड टाइटली ओवर द हैंडकरचीफ.,서든리 히즈 핑거즈 클로즈드 타이틀리 오버 더 핸드커치프.
arctic_a0054,train,There was nothing on the rock.,there was nothing on the rock.,देर वस नथिंग ऑन द रॉक.,데어 와즈 너씽 온 더 락.
arctic_a0055,train,"Philip stood undecided, his ears strained to catch the slightest sound.","philip stood undecided, his ears strained to catch the slightest sound.","फिलिप स्टुड अनडिसाइडेड, हिज़ इयर्स स्ट्रेन्ड टू कैच द स्लाइटेस्ट साउंड.","필립 스투드 언디사이디드, 히즈 이어즈 스트레인드 투 캐치 더 슬라이티스트 사운드."
arctic_a0056,train,Pearce's little eyes were fixed on him shrewdly.,pearce's little eyes were fixed on him shrewdly.,पिर्सिज लिटल आइज़ वर फिक्स्ट ऑन हिम श्रूडली.,피어시즈 리틀 아이즈 워 픽스트 온 힘 슈루들리.
arctic_a0057,train,"I have no idea, replied Philip.","i have no idea, replied philip.","आई हैव नो आइडिया, रिप्लाइड फिलिप.","아이 해브 노 아이디어, 리플라이드 필립."
arctic_a0058,test,I came for information more out of curiosity than anything else.,i came for information more out of curiosity than anything else.,आई केम फॉर इन्फ़ार्मेशन मोर आउट अव क्यूरिओसिटी धान एनीथिंग एल्स.,아이 케임 포 인포메이션 모어 아웃 어브 큐리어시티 댄 애니씽 엘스.
arctic_a0059,train,His immaculate appearance was gone.,his immaculate appearance was gone.,हिस इमैक्युलेट अपिरेंस वज़ गॉन.,히즈 이매큘럿 어피어런스 워즈 곤.
arctic_a0060,train,"Anyway, no one saw her like that.","anyway, no one saw her like that.","ऐनिवे, नो वन सॉ हर लाइक दैट.","에니웨이, 노 원 소 허 라이크 댓."
arctic_a0061,train,Philip snatched at the letter which Gregson held out to him.,philip snatched at the letter which gregson held out to him.,फिलिप स्नैचट ऐट द लेटर विच ग्रेगसन हेल्ड आउट टू हिम.,필립 스내치드 앳 더 레터 위치 그렉슨 헬드 아웃 투 힘.
arctic_a0062,train,The men stared into each other's face.,the men stared into each other's face.,द मेन स्टेर्ड इंटू ईच अदर्स फेस.,더 멘 스테어드 인투 이치 어더즈 페이스.
arctic_a0063,train,"Yes, it was a man who asked, a stranger.","yes, it was a man who asked, a stranger.","येस, इट वस अ मैन हू आस्क्ट, अ स्ट्रेंजर.","예스, 잇 워즈 아 맨 후 애스크트, 아 스트레인저."
arctic_a0064,train,The fourth and fifth days passed without any developments.,the fourth and fifth days passed without any developments.,द फोर्थ एंड फिफ्थ डेज़ पास्त विदाउट एनी डेवेलपमेंट्स.,더 포스 앤드 피프스 데이즈 패스트 위다웃 에니 디벨롭먼츠.
arctic_a0065,train,They closed now until his fingers were like cords of steel.,they closed now until his fingers were like cords of steel.,दे क्लोज्ड नाउ अंतिल हिज फिंगर्स वर लाइक कॉर्ड्स अव स्टील.,데이 클로즈드 나우 언틸 히즈 핑거즈 워 라이크 코르즈 오브 스틸.
arctic_a0066,train,He saw Jeanne falter for a moment.,he saw jeanne falter for a moment.,ही सॉ जीन फाल्टर फॉर अ मोमेंट.,히 쏘 진 팔터 포 아 모먼트.
arctic_a0067,train,"Surely I will excuse you, she cried.","surely i will excuse you, she cried.","शुरली आई विल एक्सक्यूस यू, शी क्राइड.","슈얼리 아이 윌 엑스큐즈 유, 쉬 크라이드."
arctic_a0068,dev,In a flash Philip followed its direction.,in a flash philip followed its direction.,इन अ फ्लैश फिलिप फॉलोड इट्स डिरेक्शन.,인 아 플래시 필립 팔로우드 잇츠 디렉션.
arctic_a0069,train,It was his intention to return to Eileen and her father.,it was his intention to return to eileen and her father.,इट वज़ हिज़ इंटेंशन टू रिटर्न टू आइलीन ऐंड हर फादर.,잇 와즈 히즈 인텐션 투 리턴 투 아일린 앤드 허 파더.
arctic_a0070,train,He would first hunt up Gregson and begin his work there.,he would first hunt up gregson and begin his work there.,ही वुड फर्स्ट हंट अप ग्रेगसन ऐंड बिगिन हिस वर्क देर.,히 우드 퍼스트 헌트 업 그렉슨 앤드 비긴 히즈 워크 데어.
arctic_a0071,train,What was the object of your little sensation.,what was the object of your little sensation.,व्हट वस दि ऑब्जेक्ट अव योर लिटल सेंसेशन.,왓 워즈 디 옵젝트 오브 유어 리틀 센세이션.
arctic_a0072,train,But who was Eileen's double.,but who was eileen's double.,बट हू वज आइलीन्स डबल.,벗 후 워즈 아일린즈 더블.
arctic_a0073,test,"The promoter's eyes were heavy, with little puffy bags under them.","the promoter's eyes were heavy, with little puffy bags under them.","द प्रमोटर्स आइज़ वेर हेवी, विथ लिटल पफी बैग्स अंडर देम.","더 프로모터즈 아이즈 워 헤비, 위드 리틀 퍼피 백스 언더 뎀."
arctic_a0074,train,"And now, down there, Eileen was waiting for him.","and now, down there, eileen was waiting for him.","एंड नाउ, डाउन देयर, आइलीन वस वेटिंग फॉर हिम.","앤드 나우, 다운 데어, 아일린 워즈 웨이팅 포어 힘."
arctic_a0075,train,"There has been a change, she interrupted him.","there has been a change, she interrupted him.","धेर हैज़ बीन अ चेंज, शी इंटर्रप्टेड हिम.","데어 해즈 빈 아 체인지, 쉬 인터럽티드 힘."
arctic_a0076,train,The gray eyes faltered; the flush deepened.,the gray eyes faltered the flush deepened.,द ग्रे आइज़ फाल्टर्ड द फ्लश डीपेंड.,더 그레이 아이즈 폴터드 더 플러쉬 디펀드.
arctic_a0077,train,"It is the fire, partly, she said.","it is the fire, partly, she said.","इट इज़ द फायर, पार्टली, शी सैड.","잇 이즈 더 파이어, 파트리, 쉬 셋."
arctic_a0078,train,"Then, and at supper, he tried to fathom her.","then, and at supper, he tried to fathom her.","धेन, एंड ऐट सपर, ही ट्राइड टू फैदम हर.","덴, 앤드 앳 서퍼, 히 트라이드 투 패덤 허."
arctic_a0079,train,It was a large canoe.,it was a large canoe.,इट वज़ अ लार्ज कनू.,잇 워즈 아 라지 카누.
arctic_a0080,train,What if Jeanne failed him.,what if jeanne failed him.,वट इफ जीन फेल्ड हिम.,왓 이프 진 페일드 힘.
arctic_a0081,train,What if she did not come to the rock.,what if she did not come to the rock.,व्हट इफ शी डिड नॉट कम टू द रॉक.,왓 이프 시 딛 낫 컴 투 더 록.
arctic_a0082,train,His face was streaming with blood.,his face was streaming with blood.,हिज़ फेस वज़ स्ट्रीमिंग विद ब्लड.,히즈 페이스 워즈 스트리밍 위드 블러드.
arctic_a0083,train,A shadow was creeping over Pierre's eyes.,a shadow was creeping over pierre's eyes.,अ शैडो वज़ क्रीपिंग ओवर पियरेज़ आइज़.,아 샤도우 워즈 크리핑 오버 피어레스 아이즈.
arctic_a0084,train,Scarcely had he uttered the name when Pierre's closing eyes shot open.,scarcely had he uttered the name when pierre's closing eyes shot open.,स्कार्सली हैड ही अटर्ड द नेम वेन पिराज़ क्लोसिंग आइज़ शॉट ओपन.,스케얼슬리 해드 히 어터드 더 네임 웬 피에레즈 클로징 아이즈 샷 오픈.
arctic_a0085,test,A trickle of fresh blood ran over his face.,a trickle of fresh blood ran over his face.,अ ट्रिकल अव फ्रेश ब्लड रैन ओवर हिस फेस.,아 트리클 어브 프레쉬 블러드 랜 오버 히즈 페이스.
