File ID,Data Split,Original English,English,Hindi,Korean
arctic_a0260,train,"Nobody knew his history, they of the Junta least of all.","nobody knew his history, they of the junta least of all.","नोबडी न्यू हिज़ हिस्टरी, थे अव द जुंटा लीस्ट अव ऑल.","노바디 뉴 히즈 히스토리, 데이 어브 더 준타 리스트 어브 올."
arctic_a0261,dev,I have been doubly baptized.,i have been doubly baptized.,आई हैव बिन डब्ली बैपटाइज्ड.,아이 해브 빈 더블리 밥타이즈드.
arctic_a0262,train,They wouldn't be sweeping a big vessel like the Martha.,they would not be sweeping a big vessel like the martha.,दे वुड नाट बी स्वीपिंग अ बिग वेसल लाइक द मार्था.,데이 우드 낫 비 스위핑 아 빅 베슬 라이크 더 마르타.
arctic_a0263,train,"Joan looked triumphantly at Sheldon, who bowed.","joan looked triumphantly at sheldon, who bowed.","जोन लुक्ट ट्रायअंफन्ट्ली ऐट शेल्डन, हू बाउड.","존 룩트 트라이엄펀틀리 앳 셸던, 후 바우드."
arctic_a0264,train,"And I hope you've got plenty of chain out, Captain Young.","and i hope you have got plenty of chain out, captain young.","ऐंड आई होप यू हैव गॉट प्लेंटी अव चेन आउट, कैप्टन यंग.","앤드 아이 호프 유 해브 갓 플렌티 어브 체인 아웃, 캡틴 영."
arctic_a0265,train,The discovery seemed to have been made on the spur of the moment.,the discovery seemed to have been made on the spur of the moment.,द डिस्कवरी सीम्ड टू हैव बीन मेड ऑन द स्पर अव द मॉमेंट.,더 디스커버리 심드 투 해브 빈 메이드 온 더 스퍼 옵 더 모먼트.
arctic_a0266,train,"They handled two men already, both grub-thieves.","they handled two men already, both grub-thieves.","दे हैंडल्ड टू मेन ऑलरेडी, बोथ ग्रब-थीव्ज़.","데이 핸들드 투 맨 알레디, 보스 그럽시브즈."
arctic_a0267,train,"Eli Harding asked, as Shunk started to follow.","eli harding asked, as shunk started to follow.","इली हार्डिंग आस्क्ट, ऐज़ शंक स्टार्टेड टू फॉलो.","일리 하딩 애스크트, 애즈 숑크 스타티드 투 폴로우."
arctic_a0268,train,Now go ahead and tell me in a straightforward way what has happened.,now go ahead and tell me in a straightforward way what has happened.,नाऊ गो अहेड एंड टेल मी इन अ स्ट्रेटफॉरवर्ड वे वट हैज़ हैपेंड.,나우 고 어헤드 앤드 텔 미 인 아 스트레이트포워드 웨이 왓 해즈 해펜드.
arctic_a0269,train,That's where they cut off the Scottish Chiefs and killed all hands.,that's where they cut off the scottish chiefs and killed all hands.,दैट्स वेयर थे कट ऑफ द स्कॉटिश चीफ्स ऐंड किल्ड ऑल हैंड्स.,댓츠 웨어 데이 컷 오프 더 스코티시 치프스 앤드 킬드 올 핸즈.
arctic_a0270,dev,And after the bath a shave would not be bad.,and after the bath a shave would not be bad.,ऐंड आफ्टर द बाथ अ शेव वुड नॉट बी बैड.,앤 애프터 더 배쓰 아 쉐이브 우드 낫 비 배드.
arctic_a0271,train,Now please give a plain statement of what occurred.,now please give a plain statement of what occurred.,नौ प्लीज़ गिव अ प्लेन स्टेटमेंट अव व्हाट अकर्ड.,나우 플리즈 기브 아 플레인 스테이트먼트 오브 왓 어커드.
arctic_a0272,train,You can take a vacation on pay.,you can take a vacation on pay.,यू कैन टेक अ वेकेशन ऑन पे.,유 캔 테이크 아 베이케이션 온 페이.
arctic_a0273,train,They are big trees and require plenty of room.,they are big trees and require plenty of room.,दे आर बिग ट्रीज़ ऐंड रिक्वायर प्लेंटी अव रूम.,데이 아르 빅 트리즈 앤드 리콰이어 플렌티 어브 룸.
arctic_a0274,test,And Raoul listened again to the tale of the house.,and raoul listened again to the tale of the house.,ऐंड राउल लिसन्ड अगेन टू द टेल अव द हाउस.,앤 라울 리스넛 어게인 투 더 테일 오브 더 하우스.
arctic_a0275,dev,There are no kiddies and half grown youths among them.,there are no kiddies and half grown youths among them.,देर आर नो किडिज़ ऐंड हाफ ग्रोन यूथ्स अमंग धेम.,데어 아 노 키디즈 앤드 해프 그로운 유스 어몽 뎀.
arctic_a0276,dev,Oolong Atoll was one hundred and forty miles in circumference.,oolong atoll was one hundred and forty miles in circumference.,ऊलांग अटल वस वन हंड्रेड एंड फॉर्टी माइल्स इन सरकम्फरेंस.,울롱 애톨 워즈 원 헌드레드 앤드 포티 마일즈 인 써컴퍼런스.
arctic_a0277,train,"McCoy found a stifling, poisonous atmosphere in the pent cabin.","mccoy found a stifling, poisonous atmosphere in the pent cabin.","मकॉय फाउंड अ स्टाइफलिंग, पॉइज़नस एट्मॉस्फीयर इन द पेंट कैबिन.","맥코이 파운드 아 스타이플링, 포이즈너스 앳머스피어 인 더 펜트 캐빈."
arctic_a0278,test,It would give me nervous prostration.,it would give me nervous prostration.,इट वुड गिव मी नर्वस प्रोस्ट्रेशन.,잇 우드 기브 미 너버스 프로스트레이션.
arctic_a0279,train,She said with chattering teeth.,she said with chattering teeth.,शी सेड विथ चैटरिंग टीथ.,쉬 세드 위드 차터링 티스.
arctic_a0280,train,I'll be out of my head in fifteen minutes.,i will be out of my head in fifteen minutes.,आई विल बी आउट अव माई हेड इन फिफ्टीन मिनट्स.,아이 윌 비 아웃 어브 마이 헤드 인 피프틴 미닛.
arctic_a0281,dev,I do not blame you for anything; remember that.,i do not blame you for anything remember that.,आई डू नॉट ब्लेम यू फॉर एनीथिंग रिमेम्बर दैट.,아이 두 낫 블레임 유 포 애니씽 리멤버 댓.
arctic_a0282,train,"If you mean to insinuate, Brentwood began hotly.","if you mean to insinuate, brentwood began hotly.","इफ यू मीन टू इंसिन्युएट, ब्रेंटवुड बिगैन हॉटली.","이프 유 민 투 인시뉴에이트, 브렌트우드 비긴 핫리."
arctic_a0283,train,"The woman in you is only incidental, accidental, and irrelevant.","the woman in you is only incidental, accidental, and irrelevant.","द वुमन इन यू इस ओनली इन्सिडेंटल, एक्सिडेंटल, एंड इरेलेवेंट.","더 우먼 인 유 이즈 온리 인시던털, 악시던털, 앤드 이러레벙트."
arctic_a0284,train,There was no forecasting this strange girl's processes.,there was no forecasting this strange girl's processes.,देर वस नो फॉर्कास्टिंग दिस स्ट्रेंज गर्ल्स प्रॉसेसिज़.,데어 와즈 노 포어캐스팅 디스 스트레인지 걸스 프로세스즈.
arctic_a0285,train,But what they want with your toothbrush is more than I can imagine.,but what they want with your toothbrush is more than i can imagine.,बट वट दे वांट विथ योर टूथब्रश इज मोर धन आई कैन इमैजिन.,벗 왓 데이 원트 위드 요우르 투스브러쉬 이즈 모어 댄 아이 캔 이매진.
arctic_a0286,train,Give them their choice between a fine or an official whipping.,give them their choice between a fine or an official whipping.,गिव देम धेर चॉइस बिट्वीन अ फाइन ऑर अन ऑफिशियल विपिंग.,기브 덤 더 초이스 비트윈 아 파인 오어 안 어피셜 위핑.
arctic_a0287,dev,Keep an eye on him.,keep an eye on him.,कीप अन आई ऑन हिम.,킵 안 아이 온 힘.
arctic_a0288,dev,"Those are my oysters, he said at last.","those are my oysters, he said at last.","धोज आर माई ऑइस्टर्स, ही सेड एट लास्ट.","도우즈 아르 마이 오이스터즈, 히 세드 앗 라스트."
arctic_a0289,train,"They are not regular oyster pirates, Nicholas continued.","they are not regular oyster pirates, nicholas continued.","थे आर नॉट रेग्युलर ऑयस्टर पाइरेट्स, निकोलस कंटिन्यूड.","데이 아르 낫 레귤러 오이스터 파이럿츠, 니콜러스 컨티뉴드."
arctic_a0290,train,One by one the boys were captured.,one by one the boys were captured.,वन बाइ वन द बॉयज वर कैप्चर्ड.,원 바이 원 더 보이즈 워 캡쳐드.
arctic_a0291,train,"The weeks had gone by, and no overt acts had been attempted.","the weeks had gone by, and no overt acts had been attempted.","द वीक्स हैड गॉन बाई, ऐंड नो ओवर्ट ऐक्ट्स हैड बीन अटेम्प्टेड.","더 위크스 햇 곤 바이, 앤드 노 오버트 액츠 햇 빈 어템트드."
arctic_a0292,test,"Here, in the midmorning, the first casualty occurred.","here, in the midmorning, the first casualty occurred.","हिर, इन द मिडमॉर्निंग, द फर्स्ट कैजुअल्टी अकर्ड.","히어, 인 더 미드모닝, 더 퍼스트 캐주얼티 어커드."
arctic_a0293,train,They were deep in the primeval forest.,they were deep in the primeval forest.,दे वर दीप इन द प्राइमिवल फॉरेस्ट.,데이 웨 딥 인 더 프라임이벌 포레스트.
arctic_a0294,train,He had been foiled in his attempt to escape.,he had been foiled in his attempt to escape.,ही हैड बीन फॉइल्ड इन हिज़ अटेम्प्ट टू एस्केप.,히 핻 빈 포일드 인 히즈 어템프트 투 에스케이프.
arctic_a0295,train,And twenty men could hold it with spears and arrows.,and twenty men could hold it with spears and arrows.,एंड ट्वेंटी मेन कुड होल्ड इट विथ स्पीयर्स एंड एरोज़.,앤 트웬티 멘 컬드 홀드 잇 위드 스피어즈 앤 에로우즈.
arctic_a0296,train,Bassett was a fastidious man.,bassett was a fastidious man.,बैसिट वस अ फैस्टिडियस मैन.,배싯 워즈 아 패스티디어스 맨.
arctic_a0297,dev,There's a big English general right now whose name is Roberts.,there's a big english general right now whose name is roberts.,देर अ बिग इंग्लिश जनरल राइट नाउ हूज़ नेम इज़ रॉबर्ट्स.,데어즈 아 빅 잉글리쉬 제너럴 라이트 나우 후즈 네임 이즈 로버츠.
arctic_a0298,train,This tacit promise of continued acquaintance gave Saxon a little joy-thrill.,this tacit promise of continued acquaintance gave saxon a little joy-thrill.,दिस टैसिट प्रॉमिस अव कंटिन्यूड अक्वेंटेंस गेव सैक्सन अ लिटल जॉय-थ्रिल.,디스 태싯 프라미스 어브 컨티뉴드 어퀘인턴스 게이브 색슨 아 리틀 조이쓰릴.
arctic_a0299,train,I tell you I am disgusted with this adventure tomfoolery and rot.,i tell you i am disgusted with this adventure tomfoolery and rot.,आई टेल यू आई ऐम डिसगस्टेड विथ दिस एडवेंचर टॉमफूलरी ऐंड रॉट.,아이 텔 유 아이 앰 디스거스티드 위드 디스 어드벤처 탐풀이 앤드 랏.
arctic_a0300,train,From my earliest recollection my sleep was a period of terror.,from my earliest recollection my sleep was a period of terror.,फ्रॉम माई अर्लीस्ट रिकलेक्शन माई स्लीप वज अ पीरियड अव टेरर.,프롬 마이 얼리스트 리콜렉션 마이 슬립 워즈 아 피어리어드 어브 테러.
arctic_a0301,train,But all my dreams violated this law.,but all my dreams violated this law.,बट ऑल माइ ड्रीम्स वायलेटेड दिस लॉ.,벗 올 마이 드림즈 바이올레이티드 디스 로.
arctic_a0302,train,"It is very plausible to such people, a most convincing hypothesis.","it is very plausible to such people, a most convincing hypothesis.","इट इज वेरी प्लॉज़िबल टू सच पीपल, अ मोस्ट कन्विन्सिंग हायपोथेसिस.","잇 이즈 베리 플로즈블 투 서치 피플, 아 모스트 컨빈싱 하이퍼씨스."
arctic_a0303,train,But they make the mistake of ignoring their own duality.,but they make the mistake of ignoring their own duality.,बट दे मेक द मिस्टेक अव इग्नोरिंग धेर ओन डुअलिटी.,벗 데 메이크 더 미스테이크 어브 이그노링 데어 오운 듀엘리티.
arctic_a0304,train,I graduated last of my class.,i graduated last of my class.,आई ग्रैजुएटेड लास्ट अव माई क्लास.,아이 그레듀에이티드 라스트 어브 마이 클래스.
arctic_a0305,train,"They had no fixed values, to be altered by adjectives and adverbs.","they had no fixed values, to be altered by adjectives and adverbs.","दे हैड नो फिक्स्ड वैल्यूज़, टू बी आल्टर्ड बाई ऐडजेक्टिव्ज ऐंड ऐडवर्ब्स.","데이 헤드 노 픽스트 밸류즈, 투 비 올터드 바이 애드젝티브스 앤드 애드벌브즈."
arctic_a0306,train,He was pressing beyond the limits of his vocabulary.,he was pressing beyond the limits of his vocabulary.,ही वज़ प्रेसिंग बियॉन्ड द लिमिट्स अव हिज़ वोकैब्युलरी.,히 와즈 프레싱 비욘드 더 리미츠 어브 히즈 보캐뷸러리.
arctic_a0307,train,"Very early in my life, I separated from my mother.","very early in my life, i separated from my mother.","वेरी अर्ली इन माय लाइफ, आई सेपरेटेड फ्रम माय मदर.","베리 얼리 인 마이 라이프, 아이 세퍼레이트 프럼 마이 마더."
arctic_a0308,dev,His infernal chattering worries me even now as I think of it.,his infernal chattering worries me even now as i think of it.,हिस इन्फर्नल चैटरिंग वरिज मी ईवन नाउ ऐज आई थिंक अव इट.,히즈 인퍼널 채터링 워리즈 미 이븐 나우 애즈 아이 띵크 오브 잇.
arctic_a0309,train,"White Leghorns, said Mrs Mortimer.","white leghorns, said missus mortimer.","वाइट लेगहॉर्न्स, सेड मिसस मॉर्टिमर.","화이트 레그혼스, 세드 미씨스 모티머."
arctic_a0310,train,"Massage under tension, was the cryptic reply.","massage under tension, was the cryptic reply.","मसाज अंडर टेंशन, वज़ द क्रिप्टिक रिप्लाई.","마사지 언더 텐션, 워즈 더 크립틱 리플라이."
arctic_a0311,train,"Therefore, hurrah for the game.","therefore, hurrah for the game.","देरफोर, हुर्रा फॉर द गेम.","데어포어, 허라 포어 더 게임."
arctic_a0312,train,It lived in perpetual apprehension of that quarter of the compass.,it lived in perpetual apprehension of that quarter of the compass.,इट लिव्ड इन परपेचुअल अप्रिहेंशन अव दैट क्वार्टर अव द कम्पस.,잇 리브드 인 퍼페추얼 앱리헨션 오브 댓 쿼터 오브 더 컴퍼스.
arctic_a0313,train,Broken-Tooth yelled with fright and pain.,broken-tooth yelled with fright and pain.,ब्रोकेन टूथ येल्ड विथ फ्राइट ऐंड पेन.,브로큰투스 옐드 위드 프라이트 앤드 페인.
arctic_a0314,train,Thus was momentum gained in the Younger World.,thus was momentum gained in the younger world.,धस वस मोमेंटम गेन्ड इन द यंगर वर्ल्ड.,따스 와즈 모멘텀 게인드 인 더 영거 월드.
arctic_a0315,test,"Saxon waited, for she knew a fresh idea had struck Billy.","saxon waited, for she knew a fresh idea had struck billy.","सैक्सन वेटिड, फॉर शी न्यू अ फ्रेश आइडिया हैड स्ट्रक बिली.","삭슨 웨이티드, 포어 시 누 아 프레쉬 아이디어 햇 스트럭 빌리."
arctic_a0316,train,"We had been chased by them ourselves, more than once.","we had been chased by them ourselves, more than once.","वी हैड बीन चेस्ट बाय देम आउरसेल्व्ज़, मोर दन वन्स.","위 핻 빈 체이스트 바이 뎀 아우어셀브스, 모어 댄 원스."
arctic_a0317,train,He was a wise hyena.,he was a wise hyena.,ही वस अ वाइज हाईना.,히 워즈 아 와이즈 하이에나.
arctic_a0318,train,Production is doubling and quadrupling upon itself.,production is doubling and quadrupling upon itself.,प्रोडक्शन इस डबलिंग ऐंड क्वाड्रूपलिंग अपॉन इट्सेल्फ.,프로덕션 이즈 더블링 앤드 콰드루플링 어폰 잇셀프.
arctic_a0319,train,"And the Edinburgh Evening News says, with editorial gloom.","and the edinburgh evening news says, with editorial gloom.","एंड दि एडिनबर्ग ईवनिंग न्यूज़ सेज़, विथ एडिटोरियल ग्लूम.","앤드 디 에딘버러 이브닝 뉴스 세즈, 위드 에디토리얼 글룸."
arctic_a0320,train,With my strength I slammed it full into Red-Eye's face.,with my strength i slammed it full into red-eye's face.,विथ माई स्ट्रेंथ आई स्लैम्ड इट फुल इंटू रेड-आईज़ फेस.,위드 마이 스트렝쓰 아이 슬램드 잇 풀 인투 레드아이즈 페이스.
arctic_a0321,train,The log on which Lop-Ear was lying got adrift.,the log on which lop-ear was lying got adrift.,द लॉग ऑन विच लॉप-ईर वस लाइइंग गॉट अड्रिफ्ट.,더 로그 언 위치 랍이어 워즈 라잉 갓 어드리프트.
arctic_a0322,train,This is a common experience with all of us.,this is a common experience with all of us.,दिस इज़ अ कॉमन एक्सपीरियंस विथ ऑल अव अस.,디스 이즈 아 커먼 익스피리언스 위드 올 어브 어스.
arctic_a0323,train,He considered the victory already his and stepped forward to the meat.,he considered the victory already his and stepped forward to the meat.,ही कन्सिडर्ड द विक्टरी ऑलरेडी हिस ऐंड स्टेप्ट फॉरवर्ड टू द मीट.,히 컨시더드 더 빅토리 올레디 히즈 앤드 스텝트 포워드 투 더 미트.
arctic_a0324,dev,It was not Red-Eye's way to forego revenge so easily.,it was not red-eye's way to forego revenge so easily.,इट वस नॉट रेड-आइज़ वे टू फोरगो रिवेंज सो ईज़िली.,잇 워즈 낫 레드아이즈 웨이 투 포어고 리벤지 소 이지리.
arctic_a0325,test,Whiz-zip-bang. Lop-Ear screamed with sudden anguish.,whiz-zip-bang. lop-ear screamed with sudden anguish.,विज़-जिप-बैंग. लॉप-ईयर स्क्रीम्ड विद सडन एंग्विश.,위즈집방. 랍이얼 스크림드 위드 서든 앵귀쉬.
arctic_a0326,train,Cherokee identified himself with his instinct.,cherokee identified himself with his instinct.,चेरोकी आइडेंटिफाइड हिमसेल्फ विद हिज़ इंस्टिंक्ट.,체로키 아이덴티파이드 힘셀프 위드 히즈 인스팅트.
arctic_a0327,dev,"They were less stooped than we, less springy in their movements.","they were less stooped than we, less springy in their movements.","दे वर लेस स्टूप्ड धन वी, लेस स्प्रिंगी इन धेर मूवमेंट्स.","데이 워 레스 스툽트 단 위, 레스 스프링이 인 데어 무브먼츠."
arctic_a0328,train,"The Fire People, like ourselves, lived in caves.","the fire people, like ourselves, lived in caves.","द फायर पीपल, लाइक आउरसेल्व्ज़, लिव्ड इन केव्स.","더 파이어 피플, 라이크 아우어셀브즈, 리브드 인 케이브즈."
arctic_a0329,dev,"Ah, indeed.","ah, indeed.","आ, इंडीड.","아, 인디드."
arctic_a0330,train,Red-Eye never committed a more outrageous deed.,red-eye never committed a more outrageous deed.,रेड-आई नेवर कमिटेड अ मोर आउटरेजस डीड.,레드아이 네버 커미티드 아 모어 아웃레이지어스 디드.
arctic_a0331,train,Poor little Crooked-Leg was terribly scared.,poor little crooked-leg was terribly scared.,पूर लिटल क्रुक्ड-लेग वस टेरिब्ली स्केयर्ड.,푸어 리틀 크룩레그 워즈 테러블리 스케어드.
arctic_a0332,train,"Unconsciously, our yells and exclamations yielded to this rhythm.","unconsciously, our yells and exclamations yielded to this rhythm.","अंकांशसली, आउर येल्स ऐंड एक्स्कलमेशंस यील्डिड टू धिस रिदम.","언컨셔슬리, 아우어 옐스 앤드 익스클러메이션스 일디드 투 디스 리듬."
arctic_a0333,train,This is no place for you.,this is no place for you.,दिस इज नो प्लेस फॉर यू.,디스 이즈 노우 플레이스 포어 유.
arctic_a0334,train,He'll knock you off a few sticks in no time.,he will knock you off a few sticks in no time.,ही विल नॉक यू ऑफ अ फ्यू स्टिक्स इन नो टाइम.,히 윌 낙 유 오프 아 퓨 스틱스 인 노 타임.
arctic_a0335,train,Red-Eye swung back and forth on the branch farther down.,red-eye swung back and forth on the branch farther down.,रेडआई स्वंग बैक ऐंड फॉर्थ ऑन द ब्रांच फारदर डाउन.,레드아이 스웅 백 앤드 포스 온 더 브랜치 파더 다운.
arctic_a0336,test,So unexpected was my charge that I knocked him off his feet.,so unexpected was my charge that i knocked him off his feet.,सो अनएक्सपेक्टेड वज माई चार्ज दैट आई नॉक्ड हिम ऑफ हिज फीट.,소 언익스펙티드 와즈 마이 차지 댓 아이 녹트 힘 오프 히즈 피트.
arctic_a0337,train,"Encouraged by my conduct, Big-Face became a sudden ally.","encouraged by my conduct, big-face became a sudden ally.","इंकरिज्ड बाई माई कंडक्ट, बिगफेस बिकेम अ सडन ऐलाई.","엔커리지드 바이 마이 컨덕트, 빅페이스 비케임 아 서든 앨라이."
arctic_a0338,train,The fighting had now become intermittent.,the fighting had now become intermittent.,द फाइटिंग हैड नाउ बिकम इंटरमिटेंट.,더 파이팅 해드 나우 비컴 인터미턴트.
arctic_a0339,train,"They obeyed him, and went here and there at his commands.","they obeyed him, and went here and there at his commands.","दे ओबेड हिम, ऐंड वेंट हीर ऐंड धेर ऐट हिज कमांड्स.","데이 오베이드 힘, 앤드 웬트 히어 앤드 데어 앳 히즈 커맨즈."
arctic_a0340,train,It was like the beating of hoofs.,it was like the beating of hoofs.,इट वज़ लाइक द बीटिंग अव हूफ्स.,잇 와즈 라이크 더 비팅 어브 후프스.
arctic_a0341,train,"Why, doggone you all, shake again.","why, doggone you all, shake again.","वाय, डॉगन यू ऑल, शेक अगेन.","와이, 도곤 유 올, 쉐이크 어게인."
arctic_a0342,train,"Seventeen, no, eighteen days ago.","seventeen, no, eighteen days ago.","सेवेंटीन, नो, ऐटीन डेज़ अगो.","세븐틴, 노, 에이틴 데이즈 어고."
